{
  "schema": 1,
  "composerPlatforms": [
    {
      "manifest": "packages/fixture-php/composer.json",
      "php": "8.2.0"
    }
  ],
  "pythonManifests": [
    "packages/fixture-python/pyproject.toml"
  ],
  "pythonLocks": [
    "packages/fixture-python/pylock.toml"
  ],
  "npmLocks": [
    "package-lock.json"
  ],
  "taggedNpmPackages": [
    {
      "directory": "external/tagged/js",
      "repository": "https://example.com/tagged-lib",
      "tag": "v1.2.3",
      "version": "1.2.3",
      "fix": "make install-tagged"
    }
  ],
  "exceptions": []
}
